####$, Name, pancard, date_of_birth, university_name,  ssc_marksheet_code, surname, mother_name, father_name, metric_passing_year, board_name, highest_qualification_name, highest_qualification_passing_year, mobile, res_landline,$#$
====$, employer_code, date_of_joining, date_of_leaving , exit_comments, rating, employee_code, resignation_date, designation_name, department_name, department_name, function_name, recorded_address, severance_name, reason_name, other_reason, termination_discharge_reason_name, regret_flag, rehire_flag_name, conduct_name, external_matter_history_name, history_impact_name, category_name, last_pms_performance_rating, previous_pms_year_performance_rating, before_previous_pms_year_performance_rating, ctc_on_hire, ctc_on_severance, notice_period_served_name, notice_period_paid_name, full_n_final_status_name, settlement_pending_side_name, mobile, landline, highest_qualification_name, highest_qualification_year
####$, Rakesh, R123456789, 25-11-1982, Mumbai University, SSCMSC01, Mehra,Lata,Ajit,1998, NCERT, BCom, 2003, 9876543210, 0102200202, $#$
====$ , ORCL, 14-11-2008, 14-11-2012, left for home town, 10, RKM01, 12-11-2012, Manager, Sales, Supervisor, Mulund Mumbai, Further Carier Growth, Other, personal reason, NA, Yes, Yes, Good, None, NA, Good, 10,9,8, 100000, 1500000, Yes, No, No, NA, 9988775566, 123456789, MBA, 20012
####$, Mukesh, M123456789, 25-11-1965, Mumbai University, SSCMSC01, Ambani,,,1998, NCERT, MBA, 2003, 9876543210, 0102200202, $#$
====$ , ORCL, 14-11-2008, 14-11-2012, left for home town, 10, RKM01, 12-11-2012, Manager, Sales, Supervisor, Mulund Mumbai, Further Carier Growth, Other, personal reason, NA, Yes, Yes, Good, None, NA, Good, 10,,, 100000, 1500000, Yes, No, No, NA, 9988775566, 123456789, MBA, 20012
